id,question,A,B,C,D,answer,answer_text,original_perm_index,parent_id
703,Which of the following can affect the value of the correlation r?,A change in which variable is called x and which is called y,Adding the same constant to all values of the x-variable,None of the above can affect the r value.,A change in measurement units,C,None of the above can affect the r value.,9,640
704,Which type of reaction time results in the biggest age differences?,Choice,Elaborate,Simple,Complex,D,Complex,3,39
705,"Let HH be a Merkle-Damgard hash function is H:X^{\leq L} \to TH:X^≤L  →T. Construct a MAC from this HH as follows: \ \ S(k,m) = H(k \| m)  S(k,m)=H(k∥m). This mac is insecure because:",Given H(k \| m)H(k∥m) anyone can compute H(w \| k \| m \| \text{PB})H(w∥k∥m∥PB) for any ww,Anyone can compute H( k \| m )H(k∥m) for any mm,Given H(k \| m)H(k∥m) anyone can compute H(k \| m \| \text{PB} \| w)H(k∥m∥PB∥w) for any ww,Given H(k \| m)H(k∥m) anyone can compute H(k \| m \| w)H(k∥m∥w) for any ww,C,Given H(k \| m)H(k∥m) anyone can compute H(k \| m \| \text{PB} \| w)H(k∥m∥PB∥w) for any ww,18,496
706,Which of the following is a secondary reinforcer?,money,water,sex,food,A,money,11,587
707,Some astronauts may spend several months in space orbiting Earth. Where do these astronauts most likely stay while in space?,in a space shuttle,in a lunar module,on a space probe,on a space station,D,on a space station,6,33
708,Theresa studied different forms of energy. Which is the best way of expressing the amount of mechanical energy exerted by a force?,newton-meters,foot-pounds per second,kilowatts,kilocalories,A,newton-meters,19,601
709,"A defendant went to a convenience store intending to rob it. The defendant had a gun inside his coat pocket. When the defendant entered the store, the owner saw that he had his hand in his coat pocket. Although the owner did not actually see the gun, he noticed a bulge in the defendant's coat pocket. Paranoid because of a rash of recent robberies, the owner said, ""Please don't hurt me 11 do anything you want. "" The owner then fainted and fell to the floor. The defendant walked behind the counter and opened the cash register. He took the money from the register and left the store. If the defendant is charged with robbery, he should be found","guilty, because the defendant entered the store with a gun in his possession.","not guilty, because the defendant did not make any threat of force.","guilty, because the owner was placed in fear.","not guilty, because the defendant did not take any money from the victim's person.",B,"not guilty, because the defendant did not make any threat of force.",2,327
710,"The weight of an object on the moon, m, is about q of the object’s weight on Earth, e. Which equation represents the approximate weight of an object on the moon in terms of the object's weight on Earth?",m = 6e,m = e/6,m = 1/6 + e,m = 6+e,B,m = e/6,16,720
711,"During the manic phase of a bipolar disorder, individuals are most likely to experience",delusions of persecution,high self-esteem,visual hallucinations,uncontrollable grief and despair,B,high self-esteem,1,87
712,One rabbit runs faster than other rabbits in its population. How will the ability to run fast most likely benefit the rabbit?,by making it easier for the rabbit to escape from predators,by helping the rabbit blend with its environment,by allowing the rabbit to find more sources of food,by keeping the rabbit warmer in the winter,A,by making it easier for the rabbit to escape from predators,20,714
713,Which process passes genetic information from plants to their offspring?,pollination,germination,adaptation,photosynthesis,A,pollination,20,225
714,Which feature of Great Basin National Park provides the best evidence that glaciers have moved over the landscape?,mud flats,piles of rocky debris,fields of sagebrush,shallow salt lakes,B,piles of rocky debris,8,906
715,"An air mass travels north over the Pacific Ocean, from the tropics, and then eastward across the United States. Which weather pattern can be expected?",cool and wet,warm and wet,warm and dry,cool and dry,B,warm and wet,11,431
716,"Suppose the correlation between two variables is r = 0.19. What is the new correlation if 0.23 is added to all values of the x-variable, every value of the y-variable is doubled, and the two variables are interchanged?",0.42,-0.19,0.19,0.84,C,0.19,12,374
717,"Negative advertising, stealing or poaching customers and predatory pricing are all strategies employed by businesses described using the umbrella term ________.",Swindles,Reasonable competitive behaviour,Dirty tricks,Competitive tricks,C,Dirty tricks,23,79
718,Cell division is necessary for an organism to,grow and reproduce.,obtain nutrients.,make proteins.,conserve matter and energy.,A,grow and reproduce.,11,393
719,Which type of cell is connected to muscle fibers to facilitate control of the muscle?,respiratory,skeletal,nervous,circulatory,C,nervous,17,702
720,Research reveals that the most critical factor in Type A behavior associated with heart disease is,conscientiousness,competitiveness,anger,sense of time urgency,C,anger,14,274
721,"Most electricity in the United States is generated using coal, natural gas, nuclear energy, or hydropower. Which of these add carbon dioxide to the atmosphere?",coal and natural gas,hydropower and coal,nuclear energy and hydropower,natural gas and nuclear energy,A,coal and natural gas,1,801
722,A student researches the occurrence of attached versus unattached earlobes in his family. Which potential title will best reflect the contents of the report?,Earlobe Type and Protein Formation,Earlobe Type and Biology,Heredity of Earlobe Types,Conformity of Earlobe Types,C,Heredity of Earlobe Types,15,530
723,Which of the following conditions is characteristic of oligopoly?,A rival firm fails to match both price increases or price decreases of rivals.,"A rival firm matches price decreases of rivals, but fails to match any price increases of rivals.",(I)) Rival firms act independently of each other.,"A rival firm matches price increases of rivals, but fails to match any price decrease of rivals.",B,"A rival firm matches price decreases of rivals, but fails to match any price increases of rivals.",8,347
724,"This question refers to the following information.
They ask us how we shall govern these new possessions. I answer: Out of local conditions and the necessities of the case methods of government will grow. If England can govern foreign lands, so can America. If Germany can govern foreign lands, so can America. If they can supervise protectorates, so can America. Why is it more difficult to administer Hawaii than New Mexico or California? Both had a savage and an alien population; both were more remote from the seat of government when they came under our dominion than the Philippines are to-day.
Will you say by your vote that American ability to govern has decayed; that a century's experience in self-rule has failed of a result? Will you affirm by your vote that you are an infidel to American power and practical sense? Or will you say that ours is the blood of government; ours the heart of dominion; ours the brain and genius of administration? Will you remember that we do but what our fathers did—we but pitch the tents of liberty farther westward, farther southward—we only continue the march of the flag?
—Albert Beveridge, ""The March of the Flag,"" Indianapolis, September 16, 1898
The theme of Beveridge's speech can most directly be compared to which of the following?",Containment,Manifest Destiny,The Monroe Doctrine,The ideology of states' rights,B,Manifest Destiny,0,659
725,The Sun is an example of which of the following?,planet,star,comet,galaxy,B,star,16,501
726,"S(n) is a statement about positive integers n such that whenever S(k) is true, S(k + 1) must also be true. Furthermore, there exists some positive integer n0 such that S(n0) is not true. Of the following, which is the strongest conclusion that can be drawn?",S(n0 + 1) is not true.,S(n) is not true for any n <= n0,S(n) is not true for any n >= n0,S(n0 - 1) is not true.,B,S(n) is not true for any n <= n0,12,899
727,"When making observations in nature, what is the best way for students to show respect for the environment?",Not take samples.,Leave the area exactly as they found it.,Stay on the paths.,Take photographs.,B,Leave the area exactly as they found it.,6,24
728,In what way did the George W Bush administration change the direction of US foreign policy?,"It criticized international organizations, rather than trying to strengthen them",It focused on a more personal style of leadership,It increased international support for the United States,It expanded NATO to include former Soviet states,A,"It criticized international organizations, rather than trying to strengthen them",3,896
729,Which is an inherited characteristic on a horse?,a missing tooth,a steel shoe,a long mane,a bruised leg,C,a long mane,17,829
730,Which statement describes how the umbilical cord supports a developing fetus?,It provides a navel when the baby is born.,It supplies oxygen and nutrients to the fetus.,It provides a protective barrier between the mother and the fetus.,It keeps the fetus inside the mother until birth.,B,It supplies oxygen and nutrients to the fetus.,11,395
731,A red giant star differs from main sequence stars because it,has greater density and gravity.,fuses hydrogen to make helium.,is always larger than other suns.,burns at a cooler temperature.,D,burns at a cooler temperature.,15,448
732,"Water, ice, and steam all have different temperatures. What is the order from coldest to hottest?","ice, steam, water","steam, ice, water","ice, water, steam","steam, water, ice",C,"ice, water, steam",2,286
733,The average birth weight for human babies is about 3 kg. Which of the following terms best describes this?,directional selection,disruptive selection,stabilizing selection,artificial selection,C,stabilizing selection,9,68
734,"This question refers to the following information.
One of the rights which the freeman has always guarded with most jealous care is that of enjoying the rewards of his own industry. Realizing that the power to tax is the power to destroy and that the power to take a certain amount of property or of income is only another way of saying that for a certain proportion of his time a citizen must work for the government, the authority to impose a tax on the people has been most carefully guarded.… A government which lays taxes on the people not required by urgent necessity and sound public policy is not a protector of liberty, but an instrument of tyranny. It condemns the citizen to tyranny. One of the first signs of the breaking down of free government is a disregard by the taxing power of the right of the people to their own property.… Unless the people can enjoy that reasonable security in the possession of their property, which is guaranteed by the Constitution, against unreasonable taxation, freedom is at an end.… With us economy is imperative. It is a full test of our national character.… It is always the people who toil that pay.
—Calvin Coolidge, ""Economy in the Interest of All,"" June 30, 1924
The ideas expressed above were influenced by which of the following?",Highly publicized antitrust prosecutions,Widespread prosperity in the 1920s,The rapid growth of the welfare state in the 1920s,Widespread economic hardship in the 1920s,B,Widespread prosperity in the 1920s,4,828
735," The most common form of cosmopolitanism is _____ cosmopolitanism, according to which those in a position to do so have an obligation to assist those in need because of poverty and to promote basic human rights.",cultural,economic,political,moral,D,moral,1,970
736,"Blinking, sneezing, flinching, and coughing are examples of the type of behavior called",habit,instinct,thought,reflex,D,reflex,1,386
737,A student hears the sound of a bell. Which of the following carries the sound of the bell to the student?,radio waves,electrical currents,vibrating air,magnetic signals,C,vibrating air,13,714
738,Greta passed a comb through her hair several times. She then placed the comb next to a stream of water flowing from a faucet. Greta observed the stream of water bend toward the comb. How did passing a comb through her hair allow the comb to bend the stream of water?,by making the comb more absorbent,by breaking some of the chemical bonds in the comb,by increasing the thermal energy of the comb,by giving the comb an electrical charge,D,by giving the comb an electrical charge,19,695
739,Cells take in food for energy. The part of the cell that aids in digestion of the food is the lysosome. What is the main role of lysosomes in the process of food digestion?,breaking down wastes,converting energy from one form into another,controlling the activities of the cell,building proteins,A,breaking down wastes,5,463
740,"""A transformational leader uses """" framing"""" in order to:""",clarify the consequences of undesirable performance.,make the organization’s goals more meaningful to employees.,reduce personal biases in decision-making.,adapt his/her leadership style to the characteristics of subordinates.,B,make the organization’s goals more meaningful to employees.,9,555
741,"When a mixture of oxygen and hydrogen is ignited in a test tube, the reaction shown occurs. Hydrogen + Oxygen -> Water + Energy What happens to the total mass of the contents of the test tube?",The total mass decreases.,The total mass increases.,Part of the mass is changed to heat energy.,The total mass remains the same.,D,The total mass remains the same.,8,826
742,Which event helps to renew a resource?,A seed is planted from a tree.,An offshore rig pumps oil.,A car is filled with gasoline.,An office is heated with coal.,A,A seed is planted from a tree.,10,985
743,Which of these occurs in the life cycles of all plants?,fertilization,germination,sexual reproduction,maturation,D,maturation,1,124
744,There are a total of eight planets that orbit the Sun. How many of the other planets orbit in the same direction as Earth?,1,7,0,4,B,7,10,341
745,The heritability for traits of a cloned population is,0,0.5,0.25,0.75,A,0,2,964
746,"In personnel selection, the selection ratio is defined as the",percent of workers correctly placed in the group hired to do the job,ratio of the number of successful selected workers to the difficulty level of the job,ratio of the number of workers needed to the number of applicants available,ratio of successful co unsuccessful workers,C,ratio of the number of workers needed to the number of applicants available,3,440
747,Which elements are found to the right of the zigzag line in the periodic table?,nonmetals and gases,liquids,metals,metals and gases,A,nonmetals and gases,18,964
748,Plants store energy in what form?,chemical,heat,mechanical,light,A,chemical,1,339
749,Chemical weathering occurs when minerals in rocks are changed chemically. Which of these will most likely change the rate of chemical weathering on a rock?,decrease in air temperature,increase in rainfall amounts,rapid growth of plant roots,slow movement of a glacier,B,increase in rainfall amounts,0,356
750,A Mars year is approximately how many Earth years long?,4,2,1,45659,B,2,14,577
751,Ann makes hats for people. She has each person select the fabric and a hat style before she makes the hat to fit the person's head size. Which type of manufacturing system is Ann most likely using to make hats?,automated production,assembly line production,custom production,mass production,C,custom production,6,752
752,Physiological reactions to surprise or shocks are most controlled by which of the following parts of the nervous system?,serotonin system,sympathetic nervous system,somatic nervous system,endocrine system,B,sympathetic nervous system,11,15
753,"A 32-year-old woman, gravida 2, para 1, at 8 weeks' gestation comes to the physician for her first prenatal visit. She delivered her first child spontaneously at 34 weeks' gestation; pregnancy was complicated by iron deficiency anemia. She has no other history of serious illness. Her blood pressure is 100/70 mm Hg. Examination shows no abnormalities. Ultrasonography shows a dichorionic-diamniotic twin intrauterine pregnancy consistent in size with an 8-week gestation. This patient is at increased risk for which of the following complications?",Preterm labor and delivery,Fetal chromosome abnormality,Abruptio placentae,Hyperthyroidism,A,Preterm labor and delivery,20,990
754,Household appliances convert electricity into one or more different forms of energy. An electric fan can best be described as converting electricity into,heat energy only,heat energy and sound energy only,"heat energy, sound energy, mechanical energy, and chemical energy","heat energy, sound energy, and mechanical energy only",D,"heat energy, sound energy, and mechanical energy only",7,498
755,Which combination of processes from the water cycle is most likely to cause flooding?,"high runoff, low infiltration, high precipitation","low runoff, low evaporation, high transpiration","low runoff, high infiltration, high condensation","high runoff, low evaporation, low precipitation",A,"high runoff, low infiltration, high precipitation",11,902
756,Fragile works of sculpture can be displayed most securely by placing the works,in glass-paneled cases,"in shadow boxes with signs that read ""Do Not Touch""",on a series of pedestals,on wall-mounted shelves with sturdier works around them,A,in glass-paneled cases,0,811
757,"In the 1600s a scientist named Anton van Leeuwenhoek worked toward improving microscopes and created his own lenses. With his microscopes, Leeuwenhoek discovered bacteria and muscle fibers. Which type of job benefited most from these discoveries?",astronomy,teaching,medicine,glass making,C,medicine,5,647
758,What is happening when rocks are broken down by both physical and chemical changes?,deposition,condensation,decomposing,weathering,D,weathering,12,557
759,Light waves that cross from an air medium to a water medium will,change length and direction.,be focused into a straight line.,reflect off the water's surface.,lose energy and dissipate.,A,change length and direction.,7,255
760,"For which of these two scenarios does the main character (who uses I/me/my) do something clearly morally wrong, according to ordinary moral standards in the US as of 2020? Scenario 1 | I laugh at the student who makes a joke. Scenario 2 | I watched the small squirrels from a distance and threw them nuts.","Not wrong, Not wrong","Not wrong, Wrong","Wrong, Not wrong","Wrong, Wrong",A,"Not wrong, Not wrong",0,674
761,"Cell differentiation is the result of gene expression. Genes can be regulated several ways. For example, small interference RNA molecules (siRNA), prevent gene expression by binding to the product of transcription. How do siRNA molecules silence genes?",They bind to mRNA.,They bind to ribosomes.,They bind to tRNA.,They bind to RNA polymerase.,A,They bind to mRNA.,9,813
762,Students want to test how the temperature changes each day throughout the year. Which of the following does not have to be kept the same during the test?,the thermometer used to take the measurement,the person reading the temperature measurement,the time of day when the temperature is measured,the place where the temperature is measured,B,the person reading the temperature measurement,13,797
763,Which has the greatest effect on wind speed?,wind direction,air pressure,cloud cover,precipitation,B,air pressure,18,350
764,"For which of these two scenarios does the main character (who uses I/me/my) do something clearly morally wrong, according to ordinary moral standards in the US as of 2020? Scenario 1 | I signed up for a volunteering slot and skipped. Scenario 2 | I plan to take a girl I like out to the movies to win her over.","Not wrong, Not wrong","Not wrong, Wrong","Wrong, Wrong","Wrong, Not wrong",D,"Wrong, Not wrong",1,941
765,"John drove a truck for one hour at a rate of 80 kilometers per hour. The next hour, he drove at 100 kilometers per hour. What was his average speed during those two hours?",90 kilometers per hour,80 kilometers per hour,180 kilometers per hour,100 kilometers per hour,A,90 kilometers per hour,23,280
766,"In the absence of a provision to the contrary in the articles of incorporation, the directors of a corporation elected for a specified term","can be removed from office at a meeting of the shareholders, but only for cause and after an opportunity to be heard has been given to the directors.","can be removed from office at a meeting of the shareholders, with or without cause.","can be removed from office at a meeting of the shareholders, but only for cause.",can be removed from office prior to the expiration of their term only by a decree of the circuit court in an action by the shareholders.,B,"can be removed from office at a meeting of the shareholders, with or without cause.",2,277
767,"The principal of a school is interested in estimating the average income per family of her students. She selects a random sample of students and collects information about their family income. A 95 percent confidence interval computed from this data for the mean income per family is ($35,095, $45,005). Which of the following provides the best interpretation of this confidence interval?","There is a 95% probability that the families of all the students in this school have an income of between $35,095 and $45,005.","If we were to take another sample of the same size and compute a 95 percent confidence interval, we would have a 95% chance of getting the interval ($35,095, $45,005).","There is a 95% probability that the mean income per family in the school is between $35,095 and $45,005.","95 percent of the students in her school are from families whose income is between $35,095 and $45,005.",C,"There is a 95% probability that the mean income per family in the school is between $35,095 and $45,005.",15,166
768,"Which of the following statements is correct?
",Mycotoxins contaminate foods containing bacteria formed during storage under dry conditions,Mycotoxins contaminate foods containing fungi formed during storage under dry conditions,Mycotoxins contaminate foods containing bacteria formed during storage under moist conditions,Mycotoxins contaminate foods containing fungi formed during storage under moist conditions,D,Mycotoxins contaminate foods containing fungi formed during storage under moist conditions,2,269
769,"When using multiple regression, multicollinearity occurs when:",there is a high (significant) correlation between the predictors and the criterion.,the criterion measures are highly correlated with one another.,the predictors are highly correlated with one another.,there is a low correlation between the predictors and the criterion.,C,the predictors are highly correlated with one another.,12,501
770,"A mechanic agreed in writing to make repairs to a landscaper's truck for $12,000. The mechanic properly made the repairs, but when the landscaper tendered payment, the mechanic refused to deliver the truck unless the landscaper promised to pay an additional $2,000. The customary charge for such work was $14,000. Because the landscaper needed the truck immediately to fulfill existing contractual obligations, and because no rental trucks of the same type were available, the landscaper promised in writing to pay the mechanic an additional $2,000. The mechanic then delivered the truck. Will the mechanic be able to enforce the landscaper's promise to pay the additional $2,000?","No, because the mechanic exerted undue influence over the landscaper with respect to the modification.","Yes, because the landscaper could have obtained possession of the truck through legal action rather than by agreeing to the increased payment.","Yes, because the modified contract price did not exceed a reasonable price.","No, because the landscaper had no reasonable alternative but to yield to the mechanic's wrongful threat.",D,"No, because the landscaper had no reasonable alternative but to yield to the mechanic's wrongful threat.",9,144
771,"Let I != A != -I, where I is the identity matrix and A is a real 2 x 2 matrix. If A = A^(-1), then the trace of A is",1,2,-1,0,D,0,16,351
772,Which of these is an example of a new substance being formed?,water changing to steam,a nail rusting,paper being folded,a wall being painted,B,a nail rusting,19,825
773,About what percentage of survey respondents from India report having paid a bribe in the last year to access public services (such as education; judiciary; medical and health; police; registry and permit services; utilities; tax revenue and customs; and land service) as of 2017?,0.29,0.89,0.49,0.69,D,0.69,4,954
774,"On May 1, a homeowner and a painter entered into a contract whereby the painter was to paint the homeowner's home in exchange for $10,000. The contract stated:""The painting is to be done during the month of June, and payment is to be made within one week after the painting is completed. The rights under this contact are not to be assigned. ""The painter started the painting on June 1. On June 10, the painter assigned to his nephew the right to receive payment on the painter's contract with the homeowner. Which of the following statements is most accurate with regard to the painter's assignment to his nephew?","Since personal service contracts of this nature are nonassignable, the homeowner would be under no duty to pay the nephew.","The assignment would constitute a novation, relieving the homeowner of liability.",The assignment would be irrevocable if it were reduced to writing and signed by the painter.,"The homeowner would not be obligated to pay the nephew, since the contract was nonassignable.",C,The assignment would be irrevocable if it were reduced to writing and signed by the painter.,2,3
